1487230,"FutureKreate","Apr 13, 2021","0 - 20000",0,0,89.99,0,"You become a robot. Travel over the world! Enjoy the experience of the photorealistic open-world simulator and create the future! First, Be a Real robot! You can experience various robots in research. We are using 3DCAD blueprint data in some of our robots. You can also change the view from a third-person view to a robot vision(first-person view). For example, Happy Mini 2017 has a full range camera, so you can experience that vision. Fly the skies as a drone, and go through the narrow path as a small robot. Some robots are manufactured and they have participated in robot competitions such as RoboCup. 3DCAD Manifactured Mold of the robot Because we are using 3DCAD data of a real robot, you can look at the internal mechanical design. Next, Make a new civilization! You can build your house on the ocean floor, and on top of the mountain, because you are a robot! You can also make reclaimed lands. Restore the civilization by your hand! Experience Future Robot Creator in Creator Mode! Creator Mode is intended for robotics experiments. However, you can use windows 10 3D Viewer 3D models and upload them as a robot! Experience the future architect in Creator Mode If you become a robot in Creator Mode, then next let's upload the buildings/house 3D models! We are also making our real living lab 3D floorplans public free, so feel free to use it. You can build also in the air, and make a future aerial city Upload your own robot You can upload your designed 3D blueprints &amp; 3D model in this game. Designing your own robot can change the game's difficulty. You can use the 3D CAD&amp;models upload functionality in the Creator Mode. Uploaded robots are able to control manually and with programming. Program your robots! FutureKreate is originally developed for robotics researchers. You can use the industrial standard robotics platform ROS to program robots inside the FutureKreate simulator. Develop an Artificial Intelligence inside the simulator! You can use the ROS connection in the Creator Mode. ※Creator Mode needs your robot 3d blueprint (obj, fbx, glb, gltf) to work. Characters Happy Mini 2017 Real Robot(manufactured in research) Happy Mini is a real Home Support Robot designed by Kensei Demura, by the collaborative research of D.K.T. ltd with Kanazawa Institutes of Technology Demura Robotics Lab. The robot arm was designed by ROBOTIS, OpenMANIPULATOR-X. She is designed to be a younger sister. Happy Mini has participated in a robot competition RoboCup@home 2017. She can read picture books emotionally with the technology of AI/Deep Learning. Happy Mini GAP Real Robot(In design phase) Happy Mini GAP is a real Home Support Robot in development. It was designed by several women designers in the Girls Art Project. She is designed to be a mother. She can use telepathy to control many things, with the help of IoT/smart home technology. We have made a plastic mold from the factory, but the development is still in progress. Holand Loptaro Robot in development Holand Loptaro is a robot designed by middle school student. Holand Loptaro can pass through a narrow gap. You can experience the vision of the rabbit by changing it to the robot view. Supported formats for robot avatar upload fbx obj gltf Supported 3D Modeling Software Blender Autodesk Fusion 360 Freecad Lego Digital Designer + Leocad Education Usage A variant of FutureKreate was used in Kanazawa Institutes of Technology Robotics Department Class from September 2020 to January 2021. Restore the Earth! Creative Adventure! In the year 20XX, the age of singularity has come. Doctor, athlete, architect, lawyer, clerk, waiter/waitress, cook, mechanic, construction worker, farmer, and many other jobs have been replaced by A.I. and robots. Human beings are freed from labor, and it seemed that the world had become more peaceful... However, some of the dominant human beings started world domination, and WW3 has been broken out. With the use of nuclear weapons, biological weapons, autonomous weapons in WW3, human beings became extinct from the Earth... Only non-dangerous robot beings have survived on the Earth. After human extinction, Earth restoration A.I. system 'TENSEI-chan' has made an island. TENSEI-chan called the survived robots to start a new civilization. You have been reincarnated into a robot! Craft and adventure, to restore the civilization annihilated by the sins of human beings. Create the future!","['English', 'Japanese']","[]","","https://cdn.akamai.steamstatic.com/steam/apps/1487230/header.jpg?t=1624673236","","","info@dkt.jpn.org",True,False,False,0,"",0,1,0,"",21,0,"",0,0,0,0,"D.K.T. ltd","D.K.T. ltd","Single-player,Steam Achievements,Partial Controller Support,Includes level editor,Remote Play Together","Adventure,Indie,Simulation,Early Access","Early Access,Simulation,Experimental,Open World,Sandbox,Automobile Sim,Open World Survival Craft,Software,Programming,Education,Immersive Sim,3D,Third Person,First-Person,Realistic,Nature,Character Customization,Building,Physics,Procedural Generation","https://cdn.akamai.steamstatic.com/steam/apps/1487230/ss_9831e74e92941bc75259feefd44c3f9ccbc4212e.1920x1080.jpg?t=1624673236,https://cdn.akamai.steamstatic.com/steam/apps/1487230/ss_ea167a63a4aaef633415aec45b33394dafa00686.1920x1080.jpg?t=1624673236,https://cdn.akamai.steamstatic.com/steam/apps/1487230/ss_c0458a51f0dd06611026f37e7f593e73c6f19062.1920x1080.jpg?t=1624673236,https://cdn.akamai.steamstatic.com/steam/apps/1487230/ss_8794419144b85bd83add52d229e575a2c3ff61c1.1920x1080.jpg?t=1624673236,https://cdn.akamai.steamstatic.com/steam/apps/1487230/ss_8b381fe13d15bccb4bb24a4a8b932c51f34c5afc.1920x1080.jpg?t=1624673236,https://cdn.akamai.steamstatic.com/steam/apps/1487230/ss_a3fac23afcb5b0e1507d5327da88242838c9e184.1920x1080.jpg?t=1624673236,https://cdn.akamai.steamstatic.com/steam/apps/1487230/ss_94dfd0983065a62dc9cc0c781ad675d80c06286b.1920x1080.jpg?t=1624673236,https://cdn.akamai.steamstatic.com/steam/apps/1487230/ss_88145075fa947c86766d5d39729c4a77e325f64a.1920x1080.jpg?t=1624673236,https://cdn.akamai.steamstatic.com/steam/apps/1487230/ss_3dcfde592705e99fb6da444c05a6ae198cd1ff44.1920x1080.jpg?t=1624673236,https://cdn.akamai.steamstatic.com/steam/apps/1487230/ss_b7e0ef608786435cf58187866aca29c40c8380fb.1920x1080.jpg?t=1624673236,https://cdn.akamai.steamstatic.com/steam/apps/1487230/ss_91527b89fbfa612b5be5490334df6df01b94cabd.1920x1080.jpg?t=1624673236,https://cdn.akamai.steamstatic.com/steam/apps/1487230/ss_2b64d6fed9de4964210b0d1183c952c444b171a6.1920x1080.jpg?t=1624673236,https://cdn.akamai.steamstatic.com/steam/apps/1487230/ss_30770ad99c38f4d2aea0c83ec2925bb8c8dc87c2.1920x1080.jpg?t=1624673236,https://cdn.akamai.steamstatic.com/steam/apps/1487230/ss_8cf94b5d4cf92825217cafa917a057881e461825.1920x1080.jpg?t=1624673236,https://cdn.akamai.steamstatic.com/steam/apps/1487230/ss_1c5e802108169fa9ec367c04d1bd8d3a1aefa87f.1920x1080.jpg?t=1624673236,https://cdn.akamai.steamstatic.com/steam/apps/1487230/ss_34510b185575086eaf68804439e2bc339375d57e.1920x1080.jpg?t=1624673236,https://cdn.akamai.steamstatic.com/steam/apps/1487230/ss_43e943506a488c7637e6edd70dd4a875c42192d4.1920x1080.jpg?t=1624673236,https://cdn.akamai.steamstatic.com/steam/apps/1487230/ss_797e7d789952b05687ab59f5101797f2f8521dd8.1920x1080.jpg?t=1624673236,https://cdn.akamai.steamstatic.com/steam/apps/1487230/ss_d6da753330eb0cd020e9f98aa1723885085c7c03.1920x1080.jpg?t=1624673236,https://cdn.akamai.steamstatic.com/steam/apps/1487230/ss_40a52b168220216c7e13a6d16133f83942415398.1920x1080.jpg?t=1624673236,https://cdn.akamai.steamstatic.com/steam/apps/1487230/ss_d6a3dabd07ac990bbdfed1b2eba90fcabf3d12e8.1920x1080.jpg?t=1624673236,https://cdn.akamai.steamstatic.com/steam/apps/1487230/ss_cb86636048d62cee54b3383a55b98641ebcb36d1.1920x1080.jpg?t=1624673236,https://cdn.akamai.steamstatic.com/steam/apps/1487230/ss_eebbb1a8dc2041cc5fa489a9fc2b163d60ac6b95.1920x1080.jpg?t=1624673236,https://cdn.akamai.steamstatic.com/steam/apps/1487230/ss_87d5eff94144cea55dd4241a012d30eb1538054b.1920x1080.jpg?t=1624673236,https://cdn.akamai.steamstatic.com/steam/apps/1487230/ss_0d54d20d8f3e07f3fcc521813cb1bc9704a130d8.1920x1080.jpg?t=1624673236,https://cdn.akamai.steamstatic.com/steam/apps/1487230/ss_5e71f4419e3970cdcbbc75fc65b4f2f4711e6278.1920x1080.jpg?t=1624673236,https://cdn.akamai.steamstatic.com/steam/apps/1487230/ss_89c00090d8b63827fb39a1accc1442d10c30e2c5.1920x1080.jpg?t=1624673236,https://cdn.akamai.steamstatic.com/steam/apps/1487230/ss_b456b846be3494e650eb5fec575560eadde82ee8.1920x1080.jpg?t=1624673236,https://cdn.akamai.steamstatic.com/steam/apps/1487230/ss_18c526034a539ff98f13b26df5ace2dedff2aa18.1920x1080.jpg?t=1624673236,https://cdn.akamai.steamstatic.com/steam/apps/1487230/ss_8ef4e2b8f47bae52c80e2721c36cabc7a4502f57.1920x1080.jpg?t=1624673236,https://cdn.akamai.steamstatic.com/steam/apps/1487230/ss_c46165d188e2b1a45958c8b58a904af151a5c03f.1920x1080.jpg?t=1624673236,https://cdn.akamai.steamstatic.com/steam/apps/1487230/ss_9d1fa560a95f29a52930b8595271fbfac3de326a.1920x1080.jpg?t=1624673236,https://cdn.akamai.steamstatic.com/steam/apps/1487230/ss_4d0a0693171a86430f2d4d8bcc29a7bfdee6a5ad.1920x1080.jpg?t=1624673236,https://cdn.akamai.steamstatic.com/steam/apps/1487230/ss_41ad14c55bfb1a8fc45daf2e163926d4efad1aa2.1920x1080.jpg?t=1624673236,https://cdn.akamai.steamstatic.com/steam/apps/1487230/ss_5b42f83571faead8fd29b4daf486f10db0cc26e6.1920x1080.jpg?t=1624673236,https://cdn.akamai.steamstatic.com/steam/apps/1487230/ss_c65d63e19c7ee17c7914751424c1e2c85148a57d.1920x1080.jpg?t=1624673236,https://cdn.akamai.steamstatic.com/steam/apps/1487230/ss_ee2ce43b610883cf8d02f615061f439d5c89127f.1920x1080.jpg?t=1624673236,https://cdn.akamai.steamstatic.com/steam/apps/1487230/ss_1ac65467e59e6454834e9017a1a35bdbafefa704.1920x1080.jpg?t=1624673236,https://cdn.akamai.steamstatic.com/steam/apps/1487230/ss_dab3c721f7c40c36fe186dde32be00941acca0e4.1920x1080.jpg?t=1624673236,https://cdn.akamai.steamstatic.com/steam/apps/1487230/ss_f24f14f87ab1ec6fd1f17bc0ab5ac83240d237b7.1920x1080.jpg?t=1624673236,https://cdn.akamai.steamstatic.com/steam/apps/1487230/ss_a8b2a4b15e3879b9c8daade26f71b3fad03e96cc.1920x1080.jpg?t=1624673236,https://cdn.akamai.steamstatic.com/steam/apps/1487230/ss_bf56ffec5ccc7aea1c35a801b6bb73fde88a6c2b.1920x1080.jpg?t=1624673236",""
1850420,"BYLITSA: VASNA","Feb 18, 2022","0 - 20000",0,0,1.99,0,"One day the Minnow went to the fair to buy a cow and met an old fortune-teller on the way. And she divined to him a distant road and a state-owned house, untold wealth and dashing people, great love and an insidious enemy… Which of the predictions will come true? Which path will the hero choose and how will this story end? It's up to you to choose! Bylitsa is a card visual novel inspired by Russian folk tales and the work of classics of literature. Here, at a card table in a forest tire, an ace turns into a queen of spades by itself, a zealous horse can take an unlucky thief to the underworld, and in the morning hoofprints are found on the roof of an old mill… The story is presented in the style of a 'road adventure' The original mechanics of moving around the global location Various endings Unique author's literary style","['English', 'Russian']","[]","","https://cdn.akamai.steamstatic.com/steam/apps/1850420/header.jpg?t=1645205644","https://www.facebook.com/DnovelGames/","https://www.facebook.com/DnovelGames/","support@dnovel.com",True,False,False,0,"",0,15,0,"",1,0,"",0,0,0,0,"Dnovel","Dnovel","Single-player,Steam Achievements","Action,Adventure,Indie,RPG,Early Access","Adventure,RPG,Visual Novel,Card Game,CRPG,Cute,Pixel Graphics,Atmospheric,Early Access,Story Rich,Action,Indie,Singleplayer,Music,Choices Matter","https://cdn.akamai.steamstatic.com/steam/apps/1850420/ss_9ba259b6beb40a34eb396f19431be7aa16666f13.1920x1080.jpg?t=1645205644,https://cdn.akamai.steamstatic.com/steam/apps/1850420/ss_015864cc4e38c2ebaeda18cf13d3580eb94d466a.1920x1080.jpg?t=1645205644,https://cdn.akamai.steamstatic.com/steam/apps/1850420/ss_27ddebad4b4fe31d528114e78627d5995d9a671c.1920x1080.jpg?t=1645205644,https://cdn.akamai.steamstatic.com/steam/apps/1850420/ss_f94c3b8075ac822685311ff68a990fdb04b5ab23.1920x1080.jpg?t=1645205644,https://cdn.akamai.steamstatic.com/steam/apps/1850420/ss_aa91ac1dc8f6b97869f2b5fe2cd3aa61c5c57fe8.1920x1080.jpg?t=1645205644,https://cdn.akamai.steamstatic.com/steam/apps/1850420/ss_180cea27c6a2ee5c184a355b3077b507c349411d.1920x1080.jpg?t=1645205644,https://cdn.akamai.steamstatic.com/steam/apps/1850420/ss_ce4403065901c33e174df189c49c4744b4056c05.1920x1080.jpg?t=1645205644","http://cdn.akamai.steamstatic.com/steam/apps/256873893/movie_max.mp4?t=1644901655"
1138360,"Next Hand Master","Jan 15, 2020","0 - 20000",0,0,0.99,0,"Welcome to NextHandMaster! Here we will test your real skills in managing several objects with just one hand, and do not think out any extra thoughts about the name, here you will have pain, cry, as well as millions and billions of suffering, see who becomes the real NextHandMaster! Gameplay: NextHandMaster is an action puzzle game where you have to not only put your hands and reaction into action, but also strain your head in order to think through every step, because any ill-conceived step may be the last.","['English', 'Russian']","[]","","https://cdn.akamai.steamstatic.com/steam/apps/1138360/header.jpg?t=1579150077","","","Stykabanova@yandex.ru",True,False,False,0,"",0,2,4,"",0,0,"",0,0,0,0,"del7in","Red twice potato","Single-player","Adventure,Casual,Indie","Indie,Casual,Adventure,2D,Singleplayer","https://cdn.akamai.steamstatic.com/steam/apps/1138360/ss_0578b876dcc10ab2d78afdb29885ef53592f010b.1920x1080.jpg?t=1579150077,https://cdn.akamai.steamstatic.com/steam/apps/1138360/ss_8972b000dc2e5c3826d6bb6f62e3dbdd40c50159.1920x1080.jpg?t=1579150077,https://cdn.akamai.steamstatic.com/steam/apps/1138360/ss_58dd301c6a175536d01a7e9014aa0fab077a0003.1920x1080.jpg?t=1579150077,https://cdn.akamai.steamstatic.com/steam/apps/1138360/ss_627c96342e0d028c6c322c0460e19c96140534cb.1920x1080.jpg?t=1579150077,https://cdn.akamai.steamstatic.com/steam/apps/1138360/ss_42c3e1787f33a9801ebdc7ebe5d87e86070ca0c7.1920x1080.jpg?t=1579150077,https://cdn.akamai.steamstatic.com/steam/apps/1138360/ss_56230e353418a47523e1ab529b18484487819e0d.1920x1080.jpg?t=1579150077","http://cdn.akamai.steamstatic.com/steam/apps/256758334/movie_max.mp4?t=1577646517"
1488500,"The Adventures on Uranus","Dec 17, 2020","0 - 20000",0,0,1.99,0,"The Adventures on Uranus is a short interactive experience. The game provides a chance to explore the imaginary planet of Uranus for a few minutes. There are pyramids, towers, and a town center to explore - watch out for one fun surprise when the button is pushed! There are no enemies or objectives, it's just a short and sweet exploration game. Created using the Unreal Engine, this is the first title by John Borkowski and Alex Lamontange, two teenagers who share a passion for video gaming.","['English']","[]","","https://cdn.akamai.steamstatic.com/steam/apps/1488500/header.jpg?t=1608200854","","","mike.borkowski@yahoo.com",True,False,False,0,"",0,3,0,"",0,0,"",0,0,0,0,"PizzaMen","PizzaMen","Single-player","Action","Action,Action-Adventure,3D Platformer,3D,Futuristic,Nonlinear,Singleplayer,Walking Simulator","https://cdn.akamai.steamstatic.com/steam/apps/1488500/ss_c45ccf8899d160da24566b29ddf556cbe1df9766.1920x1080.jpg?t=1608200854,https://cdn.akamai.steamstatic.com/steam/apps/1488500/ss_0af4a94d0d514a39f87f96db7ba16ae4499934d3.1920x1080.jpg?t=1608200854,https://cdn.akamai.steamstatic.com/steam/apps/1488500/ss_734bd4be646b272846280dbab672205ae6564c91.1920x1080.jpg?t=1608200854,https://cdn.akamai.steamstatic.com/steam/apps/1488500/ss_c1e46cb0fc5e9063e1c4b3cd1b88e56dffdde197.1920x1080.jpg?t=1608200854,https://cdn.akamai.steamstatic.com/steam/apps/1488500/ss_61733191d6f1b41d7ceb59d57a5d05ff30bba021.1920x1080.jpg?t=1608200854,https://cdn.akamai.steamstatic.com/steam/apps/1488500/ss_c269d931926d62796ab81025e34960bc2c3b03b9.1920x1080.jpg?t=1608200854","http://cdn.akamai.steamstatic.com/steam/apps/256811532/movie_max.mp4?t=1607508681"
731890,"Horror Hunt","Dec 27, 2019","0 - 20000",0,0,4.99,0,"**NOTE THIS GAME IS MULTIPLAYER ONLY ** Inspired by the classic 'Prop Hunt', Horror Hunt combines the elements of 'hide and seek' and a horror atmosphere. Players are separated into two teams - The Hunted, and Props. After each round the teams are swapped to play the other faction. AS THE PROP The prop's job is to prevent the 'Hunted' from finding the 4 codes to unlock the door and escape. Props may turn into almost anything from the environment, stealth, melee attack, throwing dagger, as well as night-vision (with changes / more to come). Blend in with your surroundings and wait for the time to strike. Hunt down the opposing team or prevent them from escaping to win the round. AS THE HUNTED The hunted's job is to collect the 4 codes to unlock the one key-padded door to escape and win the round. Equipped with an assault rifle with unlimited ammo, unlimited sprint, glow-sticks, traps, and a flashlight(with changes / more to come). Be on high alert while searching for the yellow pages that contains a piece of the code. Glowsticks will help remember which rooms are clear from codes. Equipped traps will help watch your back from any prop sneaking around in the area. PLAY WITH AND AGAINST FRIENDS Horror Hunt is networked by a Peer-To-Peer connection. Anyone can create a custom game and anyone may join unless password protected. Party up with your friends or possibly make some new ones!","['English']","['English']","","https://cdn.akamai.steamstatic.com/steam/apps/731890/header.jpg?t=1602372415","","","",True,False,False,0,"",0,14,11,"",0,0,"Game contains gore and violence with guns.",0,0,0,0,"Gnaw Games","Gnaw Games","Multi-player,PvP,Online PvP,Co-op,Online Co-op","Indie","Indie,Gore,Violent,Horror,Multiplayer,Co-op,FPS,Action,Shooter,Stealth,First-Person,PvP,Online Co-Op,Blood,Free to Play,Early Access,Sexual Content","https://cdn.akamai.steamstatic.com/steam/apps/731890/ss_26d0ef8a1787f862cd29c98a669d9c7fbb1ec081.1920x1080.jpg?t=1602372415,https://cdn.akamai.steamstatic.com/steam/apps/731890/ss_c014b7e79e295557c2a3ee797475a2ba5bf38d53.1920x1080.jpg?t=1602372415,https://cdn.akamai.steamstatic.com/steam/apps/731890/ss_8c588e4caba77b7321f90fb6493d4d8a359f7df6.1920x1080.jpg?t=1602372415,https://cdn.akamai.steamstatic.com/steam/apps/731890/ss_155e07258965907d2ee8aeb328a90d0ddbf18574.1920x1080.jpg?t=1602372415,https://cdn.akamai.steamstatic.com/steam/apps/731890/ss_8ad0646711943ea2bf587248f58bee6369cd5181.1920x1080.jpg?t=1602372415,https://cdn.akamai.steamstatic.com/steam/apps/731890/ss_d05e2e1faea4bb2d8697524727cfb107d495210a.1920x1080.jpg?t=1602372415,https://cdn.akamai.steamstatic.com/steam/apps/731890/ss_db4974279eaecd99b8d4bd2d0feef03772d11a84.1920x1080.jpg?t=1602372415,https://cdn.akamai.steamstatic.com/steam/apps/731890/ss_5af485dcf7a865fc0a37f844b15993e17d0817ca.1920x1080.jpg?t=1602372415,https://cdn.akamai.steamstatic.com/steam/apps/731890/ss_6decea5b6a86cf2ad7a454dddf8d3f6c2ec69302.1920x1080.jpg?t=1602372415,https://cdn.akamai.steamstatic.com/steam/apps/731890/ss_5f51db68f09a97b4b09f8353b7b6cf7bf63b0822.1920x1080.jpg?t=1602372415,https://cdn.akamai.steamstatic.com/steam/apps/731890/ss_00b00f02880177b6e12a0fb435565762f0160267.1920x1080.jpg?t=1602372415,https://cdn.akamai.steamstatic.com/steam/apps/731890/ss_e144473c62c2189535a5d2e06a71655efb87e918.1920x1080.jpg?t=1602372415,https://cdn.akamai.steamstatic.com/steam/apps/731890/ss_6364a5455448565c18acf9d3a49eca50385e54c3.1920x1080.jpg?t=1602372415","http://cdn.akamai.steamstatic.com/steam/apps/256767404/movie_max.mp4?t=1573868965"
711870,"Degauss","Nov 3, 2017","0 - 20000",0,0,2.99,0,"Degauss is an electrifying retro arcade shooter inspired by many classic games of old. Rogue-like, Arcade Gameplay Pick your weapon and last for as long as you can to rack up the highest score. Every game is a fresh, unique experience with pseudorandom enemy and pickup spawns. Build up the multipliers and decimate your enemies at close-range or strategically strike them from afar — the choice is yours. Open Powerup System Upgrading is vital to survival, and you get to choose how to do it. Whether you like raw firepower or high survivability, you pick your upgrades you need. The system is open and flexible, so if the situation calls for an extra shield or invincibility, you have that ability to react on-the-fly. Leaderboards, Multiple Game Modes Earn your ranking on the global leaderboards. Uncover clever and unique strategies and techniques to push your way to the top. Different game modes focus your skills of speed, tactics, strategy, and reaction. More Features Beautiful, bright retro graphics and sounds and effects (screenshots don't do it justice!) Amazing 80's-inspired synthwave electronic soundtrack Tight, responsive controls Easy to learn, hard to master","['English']","[]","","https://cdn.akamai.steamstatic.com/steam/apps/711870/header.jpg?t=1513005681","https://degaussgame.com","https://degaussgame.com","support@degaussgame.com",True,True,True,0,"",0,0,0,"",78,0,"",0,0,0,0,"FrozenCrate, LLC","FrozenCrate, LLC","Single-player,Steam Achievements,Full controller support,Steam Cloud,Steam Leaderboards","Action,Casual,Indie","","https://cdn.akamai.steamstatic.com/steam/apps/711870/ss_0023ea5708da5c89e7d53baad5028ae5114e9b02.1920x1080.jpg?t=1513005681,https://cdn.akamai.steamstatic.com/steam/apps/711870/ss_5ab20b22f348c79874a1cb5db7498e3942bdac07.1920x1080.jpg?t=1513005681,https://cdn.akamai.steamstatic.com/steam/apps/711870/ss_8519f948327379f261ec17ee35aa36dcaf61d64e.1920x1080.jpg?t=1513005681,https://cdn.akamai.steamstatic.com/steam/apps/711870/ss_84a062c54a15a0d1bd6f8124c5a63e3007b3f4c6.1920x1080.jpg?t=1513005681,https://cdn.akamai.steamstatic.com/steam/apps/711870/ss_f6a13031a08c24ecc0b7a262e21fac22a0092ec9.1920x1080.jpg?t=1513005681,https://cdn.akamai.steamstatic.com/steam/apps/711870/ss_4624ca6325d10092e1e397cce0abfe4e107c9b19.1920x1080.jpg?t=1513005681","http://cdn.akamai.steamstatic.com/steam/apps/256700973/movie_max.mp4?t=1510608783,http://cdn.akamai.steamstatic.com/steam/apps/256700116/movie_max.mp4?t=1509737759"
