AppID,Name,Release date,Estimated owners,Peak CCU,Required age,Price,DLC count,About the game,Supported languages,Full audio languages,Reviews,Header image,Website,Support url,Support email,Windows,Mac,Linux,Metacritic score,Metacritic url,User score,Positive,Negative,Score rank,Achievements,Recommendations,Notes,Average playtime forever,Average playtime two weeks,Median playtime forever,Median playtime two weeks,Developers,Publishers,Categories,Genres,Tags,Screenshots,Movies
972430,"Super Jigsaw Puzzle: Anime","Nov 12, 2018","0 - 20000",0,0,0.0,0,"If you like to make puzzles, Super Jigsaw Puzzle: Anime is your game. Beautiful and colorful images of anime kawaii style with a comfortable and intuitive interface and relaxing music that will allow you to concentrate on the difficult task of solving these puzzles. Solve puzzles to unlock new ones even more difficult. Up to 30! You will always have several available, do not get stuck! Drag the pieces to their position, form groups with them or use the available boxes to divide them by colors. Configurable snap system to avoid stress. Now, you can rotate the pieces! New difficulty: 800 pieces! Features 30 different puzzles Autosave, you will not lose your progress 5 levels of difficulty (40, 80, 200, 400 and 800 pieces) You can form groups with the pieces and combine them together Configurable snap 5 different interfaces Relaxing music and atmosphere","['English', 'French', 'Italian', 'German', 'Spanish - Spain', 'Simplified Chinese', 'Traditional Chinese', 'Japanese', 'Portuguese', 'Spanish - Latin America', 'Portuguese - Brazil', 'Russian']","[]","","https://cdn.akamai.steamstatic.com/steam/apps/972430/header.jpg?t=1552487330","","","info@flatcatgames.com",True,False,False,0,"",0,8,4,"",11,0,"",0,0,0,0,"Flat Cat Games","Flat Cat Games","Single-player,Steam Achievements,Steam Cloud,Stats","Casual,Indie,Simulation,Strategy","Casual,Indie,Anime,Puzzle,Mature,Nudity,Simulation,Strategy,GameMaker,Relaxing,2D,Singleplayer,Difficult,Atmospheric,Replay Value,Family Friendly,Sexual Content,Beautiful","https://cdn.akamai.steamstatic.com/steam/apps/972430/ss_011a8a7a98ed33327439893ce1d9a26b228808ee.1920x1080.jpg?t=1552487330,https://cdn.akamai.steamstatic.com/steam/apps/972430/ss_34d433c5c89f727de9eeb54ef0987d86bdde50a7.1920x1080.jpg?t=1552487330,https://cdn.akamai.steamstatic.com/steam/apps/972430/ss_11ea34b27ad59363383feb9a03d7f059aa79a413.1920x1080.jpg?t=1552487330,https://cdn.akamai.steamstatic.com/steam/apps/972430/ss_4b69ab6d09ad6153dfdc68cea6558691e894a58f.1920x1080.jpg?t=1552487330,https://cdn.akamai.steamstatic.com/steam/apps/972430/ss_20f3a4e6f39b0ebd43da2b18c5b063d77a9de492.1920x1080.jpg?t=1552487330,https://cdn.akamai.steamstatic.com/steam/apps/972430/ss_1375df53d3f3c9a6b10631037c46afda2f7a1ad3.1920x1080.jpg?t=1552487330,https://cdn.akamai.steamstatic.com/steam/apps/972430/ss_82d3fff3d20a1936cd3b9685b156b46ff56d9010.1920x1080.jpg?t=1552487330,https://cdn.akamai.steamstatic.com/steam/apps/972430/ss_2c9303780f941a527a8b2a78b94b96afb82834c3.1920x1080.jpg?t=1552487330,https://cdn.akamai.steamstatic.com/steam/apps/972430/ss_dd71c6dbf014cb5737e7c0060f8cdca46bce93f5.1920x1080.jpg?t=1552487330,https://cdn.akamai.steamstatic.com/steam/apps/972430/ss_ca5e3d677006d211dfb673bee0108d4b6d1705b6.1920x1080.jpg?t=1552487330,https://cdn.akamai.steamstatic.com/steam/apps/972430/ss_f8e7e366be12f996553e7fc25d7de8ad67e37d8b.1920x1080.jpg?t=1552487330,https://cdn.akamai.steamstatic.com/steam/apps/972430/ss_b86f40d1408cb0d40a57dd59ef8160a07f8a8c7c.1920x1080.jpg?t=1552487330,https://cdn.akamai.steamstatic.com/steam/apps/972430/ss_09e1314e877697709610b5547e50806a4e7fcbb7.1920x1080.jpg?t=1552487330,https://cdn.akamai.steamstatic.com/steam/apps/972430/ss_34e230629e9644df9c14afb7b7bec4c05f1ec85d.1920x1080.jpg?t=1552487330,https://cdn.akamai.steamstatic.com/steam/apps/972430/ss_4194c1137ba78f9dd55383094c7453b8203f9fc2.1920x1080.jpg?t=1552487330","http://cdn.akamai.steamstatic.com/steam/apps/256735361/movie_max.mp4?t=1542059913"
1269830,"KnotBot","May 8, 2020","0 - 20000",0,0,11.99,0,"Program your little KnotBot to solve unique handcrafted levels in a fun and accessible way~ Solve the levels however you want, or go for the challenge to collect all the Golden Socks! Solve Coding problems with knots and yarn-balls instead of text and numbers Everyone can understand it, even if you have no coding knowledge! Play through different areas, each with a unique mechanic to experiment with. Each area contains a series of handcrafted puzzles with cute aesthetic graphics and a relaxing soundtrack. An extra challenge for more experienced players: Get a rising challenge of difficulty on the final puzzles. Solve the puzzles under a certain amount of moves and collect all the Golden Socks!","['English']","[]","","https://cdn.akamai.steamstatic.com/steam/apps/1269830/header.jpg?t=1593281167","","","beetbomb@gmail.com",True,True,True,0,"",0,34,12,"",13,0,"",0,0,0,0,"BeetBomb","BeetBomb","Single-player,Steam Achievements","Indie,Simulation","Indie,Simulation,Programming,Puzzle,Logic,Education,Cute,Singleplayer,Automation,Sandbox","https://cdn.akamai.steamstatic.com/steam/apps/1269830/ss_a3c21f0e597ead9b4eb600353459c389681ef8d4.1920x1080.jpg?t=1593281167,https://cdn.akamai.steamstatic.com/steam/apps/1269830/ss_d30152c4e153b4395f9600efec92f7c033183ee1.1920x1080.jpg?t=1593281167,https://cdn.akamai.steamstatic.com/steam/apps/1269830/ss_c544e416b8bfd481eee3e18d555d03e773fe35d0.1920x1080.jpg?t=1593281167,https://cdn.akamai.steamstatic.com/steam/apps/1269830/ss_11a14cc73576a960f75acf48c9c1c1e1bbdcabb2.1920x1080.jpg?t=1593281167,https://cdn.akamai.steamstatic.com/steam/apps/1269830/ss_92364f9e9d28b8f8d6bd5a4ebfadf4b6d12ec71f.1920x1080.jpg?t=1593281167","http://cdn.akamai.steamstatic.com/steam/apps/256781351/movie_max.mp4?t=1588933792"
873720,"Pac Adventures 3D","Jul 20, 2018","0 - 20000",0,0,4.99,0,"Discover the classic retro game all over again! In the new 3D mazes, you must feel your dexterity and sharpness, avoid or hunt back the monsters, eat all dots to win! It has 4 game modes and 180 levels: Classic Adventure (50 levels), Big Adventure (50 levels), Need For Speed (50 levels), Pac SokoBan (30 levels). This game supports single player mode and multi-player mode that allows two players to play from the same computer cooperatively or competitively. Game Features: Smooth game play Exciting background music Single or multi player mode Good for family fun Make you laugh! Game Controls (with keyboard) Player 1: Left arrow key - turn left Right arrow key - turn right Up arrow key - turn up Down arrow key - turn down Player 2: A - turn left D - turn right W - turn up S - turn down","['English']","[]","","https://cdn.akamai.steamstatic.com/steam/apps/873720/header.jpg?t=1656031229","https://www.thankgame.com","https://www.thankgame.com","support@thankgame.com",True,False,False,0,"",0,4,2,"",0,0,"",0,0,0,0,"ThankGame.com","ThankGame.com","Single-player,Multi-player,PvP,Shared/Split Screen PvP,Co-op,Shared/Split Screen Co-op,Remote Play Together","Action,Casual,Indie,Sports","Platformer,Action,Casual,Indie,Cartoon,Sports,3D,PvP,2D Platformer,Singleplayer,Co-op,Horror,Memes,Sexual Content","https://cdn.akamai.steamstatic.com/steam/apps/873720/ss_c14e8e1dfafd16a5dd5c15182e96be6053d9d730.1920x1080.jpg?t=1656031229,https://cdn.akamai.steamstatic.com/steam/apps/873720/ss_94ccaf1cbe238a8969960d5c798798b499a7a58e.1920x1080.jpg?t=1656031229,https://cdn.akamai.steamstatic.com/steam/apps/873720/ss_ddb3a093258344275ae6621c90b9bfcaf71041e9.1920x1080.jpg?t=1656031229,https://cdn.akamai.steamstatic.com/steam/apps/873720/ss_b0dec062993981e1b7145f15bb5db7bdeb7cefde.1920x1080.jpg?t=1656031229,https://cdn.akamai.steamstatic.com/steam/apps/873720/ss_b0422ab21ebc78cafcd675068c3482267111ead3.1920x1080.jpg?t=1656031229","http://cdn.akamai.steamstatic.com/steam/apps/256723145/movie_max.mp4?t=1532054658,http://cdn.akamai.steamstatic.com/steam/apps/256721320/movie_max.mp4?t=1530317086"
939610,"Rectifying Zion","Dec 15, 2020","0 - 20000",0,0,34.99,0,"Rectifying Zion is based on historical events from around 450BC, Israel. In a time when the city of Jerusalem was being rebuilt and its people were returning after a period of exile. As player you will be faced with moral challenges and need to make choices that will ultimately direct the outcome of the game as you try to rebuild the city. Rectifying Zion is an open world role playing game that allows the player to roam around a large open world based on Israel, including Jerusalem and the temple, as well as other smaller cities, villages and farms.","['English']","['English']","","https://cdn.akamai.steamstatic.com/steam/apps/939610/header.jpg?t=1611053292","https://www.rectifyingzion.com","https://www.rectifyingzion.com","games@quasistellar.co.za",True,False,False,0,"",0,0,0,"",0,0,"",0,0,0,0,"Quasistellar Game Development","Quasistellar Game Development","Single-player","Adventure,RPG,Early Access","","https://cdn.akamai.steamstatic.com/steam/apps/939610/ss_c9c50af6a038779f21a13eaef49c4e8cea8bfd55.1920x1080.jpg?t=1611053292,https://cdn.akamai.steamstatic.com/steam/apps/939610/ss_dedcdb44dce9dd795023c4a07c42d13710f4573a.1920x1080.jpg?t=1611053292,https://cdn.akamai.steamstatic.com/steam/apps/939610/ss_056bd74fb2071e4fb1f67e38fb13624ec78b4604.1920x1080.jpg?t=1611053292,https://cdn.akamai.steamstatic.com/steam/apps/939610/ss_944063eb28ceea659b35731606f32f142204a522.1920x1080.jpg?t=1611053292,https://cdn.akamai.steamstatic.com/steam/apps/939610/ss_decd7cf053758b106fe849661726b5541b90f5fc.1920x1080.jpg?t=1611053292,https://cdn.akamai.steamstatic.com/steam/apps/939610/ss_4e8c0fb67c6f42618b938532bddf948f24e3b85e.1920x1080.jpg?t=1611053292,https://cdn.akamai.steamstatic.com/steam/apps/939610/ss_d957418e45a3dfcf0210a698ee30c0cea8edd6d6.1920x1080.jpg?t=1611053292,https://cdn.akamai.steamstatic.com/steam/apps/939610/ss_2b2acf4d1f94fb7264fc5667fde1ec5658581676.1920x1080.jpg?t=1611053292","http://cdn.akamai.steamstatic.com/steam/apps/256818721/movie_max.mp4?t=1611052277,http://cdn.akamai.steamstatic.com/steam/apps/256814214/movie_max.mp4?t=1608088294,http://cdn.akamai.steamstatic.com/steam/apps/256812967/movie_max.mp4?t=1608088302"
6020,"STAR WARS™ Jedi Knight - Jedi Academy™","Sep 16, 2009","1000000 - 2000000",180,0,9.99,0,"Forge your weapon and follow the path of the Jedi Jedi Knight: Jedi Academy is the latest installment of the highly acclaimed Jedi Knight series. Take on the role of a new student eager to learn the ways of the Force from Jedi Master Luke Skywalker. Interact with famous Star Wars characters in many classic Star Wars locations as you face the ultimate choice: fight for good and freedom on the light side or follow the path of power and evil to the dark side. Customize your character by defining both look and gender before entering the Academy to learn the power-and dangers- of the Force. Construct your own Lightsaber from handle to blade. As you progress, discover the power of wiedling two Lightsabers or the ultimate double-bladed Lightsaber made famous by Darth Maul. New vehicles, weapons, force powers and Star Wars locations. Unique level selection system allows you to choose your own missions and adventures. Six multiplayer modes including team based siege mode and two-on-one power duel. Fight in 23 multiplayer arenas!","['English', 'French', 'German', 'Spanish - Spain']","['English', 'French', 'German', 'Spanish - Spain']","","https://cdn.akamai.steamstatic.com/steam/apps/6020/header.jpg?t=1586462966","http://www.lucasarts.com","http://help.disney.com/en_US/Star-Wars/Steam","",True,True,False,81,"https://www.metacritic.com/game/pc/star-wars-jedi-knight-jedi-academy?ftag=MCD-06-10aaa1f",0,11119,454,"",0,9525,"",542,377,163,377,"Raven Software","LucasArts,Lucasfilm,Disney","Single-player,Multi-player,PvP,Online PvP,Shared/Split Screen PvP,Partial Controller Support,Steam Cloud,Remote Play Together","Action","Action,Sci-fi,Third Person,Multiplayer,Classic,Singleplayer,Moddable,Swordplay,Character Customization,FPS,Adventure,Shooter,First-Person,RPG,Third-Person Shooter,Great Soundtrack,Hack and Slash,Fighting,Female Protagonist,Story Rich","https://cdn.akamai.steamstatic.com/steam/apps/6020/ss_b025e54e7be0c0374a70cc7cda53d94e3eaf245c.1920x1080.jpg?t=1586462966,https://cdn.akamai.steamstatic.com/steam/apps/6020/ss_a760fa150ea3be09f438923933f85d63ccc9f943.1920x1080.jpg?t=1586462966,https://cdn.akamai.steamstatic.com/steam/apps/6020/ss_c8dbb6346a948e122ac7de4b87a7299108974a00.1920x1080.jpg?t=1586462966,https://cdn.akamai.steamstatic.com/steam/apps/6020/ss_722244b07245f5b64b097114c88eb9113aae1914.1920x1080.jpg?t=1586462966,https://cdn.akamai.steamstatic.com/steam/apps/6020/ss_625ee87bb3234529357814446f67eafcc2819f6d.1920x1080.jpg?t=1586462966,https://cdn.akamai.steamstatic.com/steam/apps/6020/ss_feb2570dddea903108312a7be9121360ae8ce38c.1920x1080.jpg?t=1586462966,https://cdn.akamai.steamstatic.com/steam/apps/6020/ss_03e4bbe89a52098a916b59232e3572c3159c17cb.1920x1080.jpg?t=1586462966,https://cdn.akamai.steamstatic.com/steam/apps/6020/ss_6b6b4bef912f65f2ac0d3b92416f59554c049770.1920x1080.jpg?t=1586462966,https://cdn.akamai.steamstatic.com/steam/apps/6020/ss_55fce6453329fd1283a4329b1f6bd9de280c602d.1920x1080.jpg?t=1586462966,https://cdn.akamai.steamstatic.com/steam/apps/6020/ss_f0056ec9fa4f24f7b18ee90e919c71ea5424bb91.1920x1080.jpg?t=1586462966,https://cdn.akamai.steamstatic.com/steam/apps/6020/ss_426c90ad0ca5026e6f772ddcbe641d7815248958.1920x1080.jpg?t=1586462966,https://cdn.akamai.steamstatic.com/steam/apps/6020/ss_7140d642ca6de9ee7316afc83eb2bbb1ce35ecf6.1920x1080.jpg?t=1586462966","http://cdn.akamai.steamstatic.com/steam/apps/256663513/movie_max.mp4?t=1462237022,http://cdn.akamai.steamstatic.com/steam/apps/256681357/movie_max.mp4?t=1489550169"
1557760,"6 Feet Behind","Mar 16, 2021","20000 - 50000",0,0,0.99,1,"Something is wrong. Mysterious strangers and a vengeful spirit are out to get you. You don't have any weapons. But you are not defenseless. The spirit does not spare the strangers. Use its wrath for your advantage. You might be able to survive with this tactic, but can you discover how this started? '6 Feet Behind' is a horror-themed top-down action game with a twist: instead of attacking the enemies or hiding from them, you have to make an invincible enemy collide with them. 44 levels with 4 different protagonists await you. Can you make it out alive?","['English', 'Spanish - Spain']","[]","","https://cdn.akamai.steamstatic.com/steam/apps/1557760/header.jpg?t=1615880624","","","justanothercarbonbasedmonster@gmail.com",True,False,True,0,"",0,5,0,"",0,0,"",0,0,0,0,"ApeHardware","ApeHardware","Single-player","Action,Indie","Action,Beat 'em up,2.5D,2D,3D,Hand-drawn,Stylized,Third Person,Top-Down,Atmospheric,Dark,Horror,Combat,Singleplayer,Experimental,Fast-Paced,Indie,Surreal,Psychological Horror","https://cdn.akamai.steamstatic.com/steam/apps/1557760/ss_27cfb437e4caa3c35c39de56b3c446bc62b4c4c8.1920x1080.jpg?t=1615880624,https://cdn.akamai.steamstatic.com/steam/apps/1557760/ss_c13ff958e9fa179bed48b547037eec56733264db.1920x1080.jpg?t=1615880624,https://cdn.akamai.steamstatic.com/steam/apps/1557760/ss_4ab8e20e0edbf71baaa887c02a8dab7172aa70de.1920x1080.jpg?t=1615880624,https://cdn.akamai.steamstatic.com/steam/apps/1557760/ss_e4a4dee14c1e23b94812789487fadf421dea3943.1920x1080.jpg?t=1615880624,https://cdn.akamai.steamstatic.com/steam/apps/1557760/ss_2b51bd4db37892afcbf549f55f045db47479e303.1920x1080.jpg?t=1615880624,https://cdn.akamai.steamstatic.com/steam/apps/1557760/ss_c98e934bc389940d84a98f63fcfa2ef910cb2c55.1920x1080.jpg?t=1615880624","http://cdn.akamai.steamstatic.com/steam/apps/256822930/movie_max.mp4?t=1614783843"
843930,"Cyadonia","May 7, 2018","0 - 20000",0,0,0.0,0,"Cyadonia is now FREE! Are you smart enough for Cyadonia? Hundreds of clever block-sliding puzzles to challenge your mind in this retro-puzzler! OBJECT OF THE GAME: Get the Cyad to the exit on each screen. It sounds simple... FEATURES Collect precious gems, avoid mines, enter teleports, hit switches, open locks, deflect lasers, disable the traps and find your way home! Hundreds of devious levels; hours of gameplay! Play the tutorial. Easy levels for beginners, challenging levels for masters! Quiet, relaxing, thoughtful gameplay. No time pressures, infinite lives; It's just you against the puzzles! Find the optimal routes to win stars and unlock bonus levels! Earn solutions for when you are stuck! All levels unlocked, no artificial progression! Share your progress and play on PC and Android mobile, available in Google Play Store!","['English']","[]","","https://cdn.akamai.steamstatic.com/steam/apps/843930/header.jpg?t=1597322556","http://www.cyadonia.co.uk/","","cyadonia@cyadgames.com",True,False,False,0,"",0,8,1,"",0,0,"",0,0,0,0,"Cyad Games","Cyad Games","Single-player","Indie","Indie,Puzzle,Casual,Relaxing,Logic","https://cdn.akamai.steamstatic.com/steam/apps/843930/ss_644a9efc4583986a5536b0ce077c91baec5a660b.1920x1080.jpg?t=1597322556,https://cdn.akamai.steamstatic.com/steam/apps/843930/ss_24f085c0b9c821e28b4554419a8ec4fb95d2c86e.1920x1080.jpg?t=1597322556,https://cdn.akamai.steamstatic.com/steam/apps/843930/ss_16a1fd2c8bd29aececae178b9adb5299bc042790.1920x1080.jpg?t=1597322556,https://cdn.akamai.steamstatic.com/steam/apps/843930/ss_dc2c4dd1c6f38dd95adf8c1ac0827f68fd8d1042.1920x1080.jpg?t=1597322556,https://cdn.akamai.steamstatic.com/steam/apps/843930/ss_db62764749cbea7cdc1f2e095a28203c5df712e6.1920x1080.jpg?t=1597322556,https://cdn.akamai.steamstatic.com/steam/apps/843930/ss_ebb3aae009bdee4701bdca6794d8105a038e1e2c.1920x1080.jpg?t=1597322556,https://cdn.akamai.steamstatic.com/steam/apps/843930/ss_deaf83545c42a148ec7f31942ad4294bc13aa2fa.1920x1080.jpg?t=1597322556,https://cdn.akamai.steamstatic.com/steam/apps/843930/ss_d38e3897bb6a663fae7076efe8c7b99a63d5ecd9.1920x1080.jpg?t=1597322556,https://cdn.akamai.steamstatic.com/steam/apps/843930/ss_398e4e141e33ab03a2253c54a71dad216c2e4f30.1920x1080.jpg?t=1597322556,https://cdn.akamai.steamstatic.com/steam/apps/843930/ss_8abdbd1abeb642975e9a530def8fb4468ce7ab46.1920x1080.jpg?t=1597322556,https://cdn.akamai.steamstatic.com/steam/apps/843930/ss_1b6ffddbc170ef60c361a810d335a9affc6cae32.1920x1080.jpg?t=1597322556,https://cdn.akamai.steamstatic.com/steam/apps/843930/ss_5ac6d0ed87664dadde9e620d368c4ac4ab0af3c7.1920x1080.jpg?t=1597322556,https://cdn.akamai.steamstatic.com/steam/apps/843930/ss_b200cc7618359ea9fbd952f114d4b9564ca7a4df.1920x1080.jpg?t=1597322556,https://cdn.akamai.steamstatic.com/steam/apps/843930/ss_768e588d1c43f8dc41932b600cb6d5422c378584.1920x1080.jpg?t=1597322556,https://cdn.akamai.steamstatic.com/steam/apps/843930/ss_9f9d0841cfef9044034fcb7fadd336d678e5446b.1920x1080.jpg?t=1597322556,https://cdn.akamai.steamstatic.com/steam/apps/843930/ss_78b85800105fa0bc3e1a5ff5edeb4ded0de0a850.1920x1080.jpg?t=1597322556,https://cdn.akamai.steamstatic.com/steam/apps/843930/ss_df19dc1a4e608ad9dd632a8a2a2d8321b123d3a0.1920x1080.jpg?t=1597322556","http://cdn.akamai.steamstatic.com/steam/apps/256713817/movie_max.mp4?t=1523553398"
1052030,"Star Impact","May 13, 2019","0 - 20000",0,0,4.99,0,"Clever Indie gameplay puts a smart twist on the classic style you know and love. As a modern gamer, you will feel refreshed and challenged, but your inner child will be jumping for joy as you are flooded with epic gaming memories. Quotes 'If you have any love for Donkey Kong Barrels from the SNES days, prepare to meet your maker.' 'I was left very impressed with the game play dynamics and I think it's really worth taking a look at, especially at the price it's selling for' 'Fun run platformer with a nice challenge. Reminds me of some of the more unforgiving games from my childhood. Great soundtrack!' Gameplay Gameplay Gameplay! Star Impact is all about classic platforming gameplay. There is a story, beautiful graphics, rad 80s synth music, but the retro style gameplay is the foundation. A throwback to the great classics like Mario, Sonic, and Super Donkey Kong. If you grew up with the classics, this game will make you relive your childhood. Nostalgia Star Impact is a game for real gamers; Noobs and Farmville lovers beware. The game stars slower and gradually speed up as you progress. Play through a huge contiguous level that changes with each difficulty. With three difficulties, you can learn the basics through gameplay, while honing your skill for higher difficulties. Time your jumps and dashes while collecting the Star Impact to achieve the highest score. Fun / Fast / Hard / Replayable Play as Stella Striker, the pilot of the Interstellar space-ship Icarus II and unravel the mysteries of the galaxy. Avoid an army of ancient aliens, deadly environments, and solve unique environmental puzzles while maintaining faced paced gameplay. Blast Stella around the map through various cannons, Donkey Kong style. Leave earth, find the rare material Star Impact, and break through the barriers of space travel by securing the future of interstellar human travel! Features - Single Player: Play the story of human Interstellar space travel. - Leaderboard: Get the best score, time, and become the top speed runner in the world! - Controls: Control Stella Striker with only two buttons, this game is great for kids! - Gameplay: Platforming, jumping, dashing, cannons, spikes, ancient aliens. - Puzzles: Solve various puzzles through platforming gameplay mechanics. - Space-time: Witness the visual power of distorting space and time. - 80s Synth: Unlock new music tracks and set your playlist to earn boosts while playing. Steam Features - Steam Achievements: Unlock sweet and unique achievements. - Steam Leaderboard: Compare your score and speed run against your friends and all players. - Gamepad: Partial gamepad supports, or play with a keyboard or mouse. Kids and physically challenged Control Stella Striker with only two buttons! This is a great game for kids, physically challenged, and adults.","['English']","['English']","","https://cdn.akamai.steamstatic.com/steam/apps/1052030/header.jpg?t=1558368711","https://www.megamesdev.com/star-impact.html","https://www.megamesdev.com/contact.html","matt@megamesdev.com",True,True,False,0,"",0,11,0,"",6,0,"",0,0,0,0,"Me Games","Me Games","Single-player,Steam Achievements,Partial Controller Support,Steam Leaderboards","Action,Casual,Indie","Action,Indie,Casual,Platformer,Runner,Sci-fi,Difficult,Singleplayer,Puzzle-Platformer,Female Protagonist,Hardware","https://cdn.akamai.steamstatic.com/steam/apps/1052030/ss_700041ea4e89bcb61939b43536cebf5faa8ce7c3.1920x1080.jpg?t=1558368711,https://cdn.akamai.steamstatic.com/steam/apps/1052030/ss_f2698db05bdc07953153d2656b66713e9262680c.1920x1080.jpg?t=1558368711,https://cdn.akamai.steamstatic.com/steam/apps/1052030/ss_8bf204a1a2673e03d3276ab0c353d90ec3266d0a.1920x1080.jpg?t=1558368711,https://cdn.akamai.steamstatic.com/steam/apps/1052030/ss_4d85ed13e831b0c3b226442e5f216c71aae72498.1920x1080.jpg?t=1558368711,https://cdn.akamai.steamstatic.com/steam/apps/1052030/ss_5a6a514913479042555791a0f8830e44dbe324e8.1920x1080.jpg?t=1558368711,https://cdn.akamai.steamstatic.com/steam/apps/1052030/ss_2c1f7d194608c8364e3324239e80440c6f2e18e8.1920x1080.jpg?t=1558368711,https://cdn.akamai.steamstatic.com/steam/apps/1052030/ss_3e330479efbdfa702fa730f1744c08565a913c0b.1920x1080.jpg?t=1558368711,https://cdn.akamai.steamstatic.com/steam/apps/1052030/ss_46d13cf9162ba70a8130954b175088fa3f70e882.1920x1080.jpg?t=1558368711,https://cdn.akamai.steamstatic.com/steam/apps/1052030/ss_b8e361e93e5fbea570dbe1a5931e67c84e65cd98.1920x1080.jpg?t=1558368711,https://cdn.akamai.steamstatic.com/steam/apps/1052030/ss_3ebd56e0fda0bb202e1f4b7548998aa2a94c8f8a.1920x1080.jpg?t=1558368711","http://cdn.akamai.steamstatic.com/steam/apps/256751140/movie_max.mp4?t=1558365909,http://cdn.akamai.steamstatic.com/steam/apps/256749775/movie_max.mp4?t=1557041523"
840310,"SLICE","May 10, 2018","20000 - 50000",0,0,4.99,1,"SLICE is a 2D game where you slice objects to solve puzzles. Slice through various unique levels full of mind-clicking experience. Use fun to explore gameplay mechanics to combine thinking with slicing. Key Features Minimalistic visual design Challenging and rewarding puzzles Light and Dark versions of levels Fun to discover gameplay mechanics Original, atmospheric music Meditative atmosphere 2 FREE additional contents 225 UNIQUE LEVELS in total Note: you should not do this if you want to solve the puzzle:","['English']","[]","","https://cdn.akamai.steamstatic.com/steam/apps/840310/header.jpg?t=1635454552","","","giorgi.abelashvili@gmail.com",True,True,True,0,"",0,51,2,"",50,0,"",0,0,0,0,"Giorgi Abelashvili,Nukri Zhvania","Giorgi Abelashvili","Single-player,Steam Achievements,Steam Cloud","Casual,Indie","Indie,Casual,Puzzle,2D,Relaxing","https://cdn.akamai.steamstatic.com/steam/apps/840310/ss_7a4e28bcc1976c80a757fdf78990a2937462ea08.1920x1080.jpg?t=1635454552,https://cdn.akamai.steamstatic.com/steam/apps/840310/ss_6878790153d692b1de471ff9d6f949ac11a0008a.1920x1080.jpg?t=1635454552,https://cdn.akamai.steamstatic.com/steam/apps/840310/ss_514eead87a429b798f9b8e831909165e98819369.1920x1080.jpg?t=1635454552,https://cdn.akamai.steamstatic.com/steam/apps/840310/ss_212adb5e1a0a9915ed4590252f5c2a525ba74e56.1920x1080.jpg?t=1635454552,https://cdn.akamai.steamstatic.com/steam/apps/840310/ss_c50f0e5d39f7fc2ce09e5933b226692676092d35.1920x1080.jpg?t=1635454552,https://cdn.akamai.steamstatic.com/steam/apps/840310/ss_00f875837dc8e943a9cadf034457add1bd36bdbe.1920x1080.jpg?t=1635454552,https://cdn.akamai.steamstatic.com/steam/apps/840310/ss_00bcfe2dc2f1bd32b8e3a9afce4e7f4aac25d4ea.1920x1080.jpg?t=1635454552","http://cdn.akamai.steamstatic.com/steam/apps/256714844/movie_max.mp4?t=1602600937"
